title,language,issn,issn2
societe marocaine dophtalmologie journal,Text in French,2550-3987,2658-851X
revue marocaine de lentrepreneuriat de linnovation et du management,Text in French | Text in Arabic | Text in English,2509-0429,NA
journal deconomie de management de environnement et de droit,Text in French | Text in Arabic | Text in English,2605-6461,NA
international journal of innovation and scientific research,Text in English,2336-0046,NA
revue des langues cultures et societes,Text in French,2550-651X,NA
international journal of accounting finance auditing management and economics,Text in French | Text in English,2658-8455,NA
international journal of information science and technology,Text in English,2550-5114,NA
reperes et perspectives economiques,Text in French | Text in Arabic | Text in English,2509-0399,NA
recherches et applications en finance islamique,Text in French | Text in Arabic | Text in English,2509-0224,NA
african agri magazine,Text in French,2794-1051,NA
namibia scientific society journal,Text in German | Text in English,1018-7677,NA
eubios journal of asian and international bioethics,Text in English,2350-3106,NA
namibia development journal,Text in English,1995-4735,NA
nawa,Text in English,1993-3835,NA
international science and technology journal of namibia,Text in English,2026-7673,NA
journal of studies in humanities and social sciences,Text in English,2026-7215,2026-8637
julace,Text in English,2026-8297,2026-7541
namibia cpd journal for educators,Text in English,2026-772X,2026-8610
madoqua,Text in English,null,NA
family law,Text in English,2542-5242,NA
nigerian journal of forestry,Text in English,0374-9584,NA
ife african studies,Text in English,0331-0191,NA
nigerian nurse,Text in English,0331-4448,NA
nigerian journal of entomology,Text in English,0331-0094,NA
african journal of academic librarianship,Summaries in French | Text in English,0189-6709,NA
west african journal of sociology and political science,Text in English,0308-4450,NA
west african journal of modern languages,Text in English,0331-0531,NA
african crusader,Text in English,null,NA
ahmadu bello university centre of islamic legal studies journal,Text in English,0065-468X,NA
nigeria educational forum journal,Text in English,0189-2916,NA
black orpheus,Text in English,0067-9100,NA
theses and dissertations accepted for higher degrees in nigerian universities,Text in English,0082-4100,NA
university geographer,Text in English,0083-3975,NA
west african journal of archaeology,Text in French | Text in English,0331-3158,NA
west african religion,Text in English,0083-8187,NA
ife journal of agriculture,Text in English,0331-6351,NA
nigerian journal of international affairs,Text in English,0331-3646,NA
nsukka library notes,Text in English,0331-1481,NA
ife journal of history,Text in English,1116-4689,2504-8899
west african journal of pharmacology and drug research,Text in English,0303-691X,NA
nigerian journal of political science,Text in English,0331-8524,NA
nigerian forum,Text in English,0189-0816,NA
nigerian institute of social and economic research research for development,Text in English,0189-0085,NA
nigeria society of physiotherapy journal,Text in English,0331-3735,NA
samaru journal of agricultural research,Text in English,0331-7285,NA
nigeria national animal production research institute journal,Text in English,0189-0514,NA
nigeria work in progress,Text in English,null,NA
african journal of biblical studies,Text in English,0795-7602,NA
medipharm medical journal,Text in English,0794-3733,NA
west african science association journal,Text in English,0043-3020,NA
nigerian current law review,Text in English,0189-207X,NA
african journal of genetics,Text in English,0795-6762,NA
obafemi awolowo university law journal,Text in English,null,NA
apri journal,Text in English,null,NA
journal of english studies,Text in English,0189-6652,NA
saiwa,Text in English,0795-2864,NA
nigerian library and information science review,Text in English,0189-4412,NA
lagos education review,Text in English,0331-9237,NA
zariya veterinarian,Text in English,0794-5086,NA
tropical freshwater biology,Text in English,0795-0101,NA
college press annual lecture series,Text in English,null,NA
asia africa forum,Text in English,null,NA
african journal of international affairs development,Text in English,1117-272X,NA
tropical veterinarian,Text in English,0794-4845,NA
african journal of library archives and information science,Text in English,0795-4778,NA
nse technical transactions,Text in English,null,NA
journal of nigerian languages and literatures,Text in English,0943-1640,NA
nigerian journal of animal production,Text in English,0331-2062,NA
ife psychologia,Text in English,1117-1421,NA
apa,Text in English,null,NA
africa online inasp london,Text in English,null,NA
journal of business social studies,Text in English,null,0021-9428
bmj nigerian edition,Text in English,1118-4485,NA
bmj west african edition,Text in English,1119-2984,NA
journal africain de genetique,Text in French,null,NA
the literary digest,Text in English,null,NA
african journal of reproductive health,Text in French | Text in English,1118-4841,NA
global journal of pure and applied sciences,Text in English,1118-0579,NA
nigerian journal of policy and strategy,Text in English,null,NA
bulletin of social and behavioural sciences,NA,2276-8432,NA
research journal of peace and conflict studies,Text in English,2276-8416,NA
african journal of social sciences,Text in English,null,NA
educational research review,Text in English,null,NA
international journal of biochemistry and biotechnology,Text in English,2169-3048,NA
international journal of medicinal plant research,Text in English,2169-303X,NA
scholarly journal of agricultural science,Text in English,2276-7118,NA
international journal of economic development research and investment,Text in English,2141-6729,NA
journal of environmental issues and agriculture in developing countries,Text in English,2141-2731,NA
interdisciplinary academic essays,Text in French | Text in German | Text in Ukrainian | Text in English | Text in Russian,2360-7718,NA
international journal of innovative healthcare research,Text in English,null,2354-2950
elite research journals of clinical pharmacy medicine and medical sciences,Text in English,2384-8014,NA
african journal of wood science and forestry,Text in English,2375-0979,NA
journal of experimental research,Text in English,2315-9650,NA
pyrex journal of medicine and medical services,Text in English,2579-1230,NA
pyrex journal of research in environmental studies,Text in English,2579-1257,NA
idosr journal of biology chemistry and pharmacy,Text in English,2579-0730,NA
idosr journal of science and technology,Text in English,2579-079X,NA
idosr journal of current issues in social sciences,Text in English,2579-0765,NA
idosr journal of biochemistry biotechnology and allied fields,Text in English,2579-0811,NA
idosr journal of current issues in arts and humanities,Text in English,2579-0757,NA
idosr journal of experimental science,Text in English,2579-0781,NA
medpulse international journal of orthopedics,Text in English,2579-0889,NA
medpulse international journal of psychology,Text in English,2579-0919,NA
medpulse international journal of forensic medicine,Text in English,2579-0935,NA
medpulse international journal of ear nose and throat,Text in English,2579-0854,NA
medpulse international journal of gynaecology,Text in English,2579-0870,NA
medpulse international journal of pediatrics,Text in English,2579-0897,NA
medpulse international journal of dentistry,Text in English,2579-1125,NA
medpulse international journal of community medicine,Text in English,2579-0862,NA
medpulse international journal of anaesthesia,Text in English,2579-0900,NA
medpulse international journal of physiotherapy,Text in English,2579-1133,NA
medpulse international journal of radiology,Text in English,2579-0927,NA
ewemen journal of arts and sociology,Text in English,2579-0978,NA
ewemen journal of petrochemical research and innovation,Text in English,2579-096X,NA
international journal of medical evaluation and physical report,Text in English,2695-2181,2579-0498
research journal of humanities and cultural studies,Text in English,2695-2467,2579-0528
world journal of entrepreneurial development studies,Text in English,2695-2483,2579-0544
journal of law and global policy,Text in English,2695-2424,2579-051X
research journal of pure science and technology,Text in English,2695-2696,2579-0536
african journal of history and archaeology,Text in English,2695-1851,2579-048X
international journal of religion and cultural practice,Text in English,2695-219X,2579-0501
international journal of scientific research in education studies and social development,Text in English,2579-1052,2579-1060
international journal of scientific research in social science and management studies,Text in English,2579-101X,2579-1028
international journal of scientific research in humanities legal studies and international relations,Text in English,2579-0986,2579-0994
international journal of scientific research in technology applied sciences and health services,Text in English,2579-1044,NA
akwapoly journal of communication and scientific research,Text in English,2616-0773,NA
idosr journal of computer and applied sciences,Text in English,2579-0803,NA
idosr journal of arts and humanities,Text in English,2579-0773,NA
idosr journal of banking economics and social sciences,Text in English,2579-082X,NA
imt international journal of the arts and sciences,Text in English,2579-1362,NA
international journal of communication,Text in English,1597-4324,NA
fupre journal of scientific and industrial research,Text in English,2579-1184,2579-1192
tropical journal of natural product research,Text in English,2616-0684,2616-0692
the information technologist,Text in English,1597-4316,NA
annals of health research,Text in English,2536-6149,NA
clinical review and opinions,Text in English,2141-2553,NA
international journal of computer engineering research,Text in English,2141-6494,NA
international journal of educational administration and policy studies,Text in English,2141-6656,NA
journal of dryland agriculture,Text in English,2476-8650,NA
journal of land management and appraisal,Text in English,2354-1741,NA
journal of medical laboratory and diagnostics,Text in English,2141-2618,NA
journal of neuroscience and behavioural health,Text in English,2141-2286,NA
ibom medical journal,Text in English,1597-7188,NA
journal of nigerian society of physical sciences,Text in English,2714-4704,2714-2817
sky journal of agricultural research,Text in English,2315-8751,NA
sky journal of business administrative and management research,Text in English,2315-8778,NA
sky journal of medicinal plant research,Text in English,2315-8786,NA
sky journal of medicine and medical science,Text in English,2315-8808,NA
sky journal of microbiological research,Text in English,2315-876X,NA
sky journal of soil science and environmental management,Text in English,2315-8794,NA
international journal of peace and conflict studies,Text in English,2354-1598,2346-7258
international journal of capacity building in education and management,Text in English,2346-7231,NA
nigerian mathematical society journal,Text in English,null,NA
nigerian food journal,Text in English,null,NA
african association of physiological sciences journal,Text in English,2315-9987,2449-108X
nigerian journal of chest diseases,Text in English,2408-7386,NA
pencil publication of physical sciences and engineering,Text in English,2408-7491,NA
pencil publication of social sciences,Text in English,2408-7564,NA
scsr journal of agribusiness,Text in English,2384-5325,NA
scsr journal of development,Text in English,2384-5341,NA
scsr journal of management and marketing,Text in English,2384-535X,NA
west african journal of business and management sciences,Text in English,2384-5104,NA
world journal of biomedical research,Text in English,2384-5805,NA
international journal of ecology and ecosolution,Text in English,2437-1327,NA
international journal of ethnomedicine and pharmacognosy,Text in English,2437-1262,2437-1254
international journal of moringa and nutraceutical research,Text in English,2437-1955,NA
intraspecific journal of biochemistry and biotechnology,Text in English,2437-1580,NA
journal of public administration and personnel management,Text in English,2437-2048,NA
journal of trends in social networks and human factor and ergonomics,Text in English,2437-2056,NA
umudike journal of engineering and technology,Text in English,2545-5257,NA
academic web journal of agricultural research,Text in English,2545-4994,NA
academic web journal of medical science,Text in English,2545-4986,NA
african journal of theory and practice of educational assessment,Text in English,2545-5834,NA
annals of clinical sciences,Text in English,2545-5419,NA
cach journal of humanities and cultural studies,Text in English,2545-5540,NA
card international journal of educational research and managerial technology,Text in English,2545-5893,NA
card international journal of management studies business and entrepreneurship research,Text in English,2545-5907,2545-5885
fuw journal of agriculture and life sciences,Text in English,2545-5141,2545-515X
international journal of academic research and innovation,Text in English,2545-5214,NA
international journal of marketing and communication studies,Text in English,2695-2173,2545-5273
international journal of academy of engineering research and theory,Text in English,2545-5931,NA
international journal of advanced geotechnic and impact engineering,Text in English,2545-5559,NA
international journal of advanced multidisciplinary academic research and development,Text in English,2545-5354,NA
international journal of advanced structural and robotic engineering,Text in English,2545-5656,NA
international journal of chemistry and chemical processes,Text in English,2695-1916,2545-5265
international journal of computer science and mathematical theory,Text in English,2695-1924,2545-5699
international journal of economics and financial management,Text in English,2695-1932,2545-5966
international journal of english language and communication studies,Text in English,2695-2157,2545-5702
international journal of health and pharmaceutical research,Text in English,2695-2165,2545-5737
international journal of petro chemical and agro allied research,Text in English,2545-5923,NA
journal of biology and genetic research,Text in English,2695-222X,2545-5710
journal of business and african economy,Text in English,2695-2238,2545-5281
journal of engineering and applied disciplines,Text in English,2545-5222,NA
journal of humanities and social policy,Text in English,2695-2416,2545-5729
journal of research in science education,Text in English,2545-5788,NA
lajast engineering science and technology,Text in English,2545-5583,NA
lajast environmental sciences,Text in English,2545-5605,NA
lajast humanities and social sciences,Text in English,2545-5591,NA
african journal of criminal law and jurisprudence,Text in English,2550-746X,NA
idosr journal of applied sciences,Text in English,2550-7931,NA
idosr journal of arts and management,Text in English,2550-7974,NA
idosr journal of communication and english,Text in English,2550-7958,NA
idosr journal of humanities and social sciences,Text in English,2550-7966,NA
idosr journal of scientific research,Text in English,2550-794X,NA
ilorin journal of computer science and information technology,Text in English,2550-7214,NA
international journal for psychotherapy in africa,Text in English,2550-7257,2550-7249
international journal of advanced modelling and analysis in engineering,Text in English,2550-7206,NA
international journal of advances in civil and infrastructure engineering,Text in English,2550-7192,NA
international journal of advances in engineering materials and processes,Text in English,2550-7230,NA
international journal of applied geophysics and computational fluid mechanics,Text in English,2550-7222,NA
journal of epizootiology and animal health in west africa,Text in English,2550-7990,NA
lafia journal of economics and management sciences,Text in English,2550-732X,NA
medpulse international journal of anatomy,Text in English,2550-7621,NA
medpulse international journal of ayurveda,Text in English,2550-7656,NA
medpulse international journal of biochemistry,Text in English,2550-763X,NA
medpulse international journal of medicine,Text in English,2550-7583,NA
medpulse international journal of surgery,Text in English,2550-7591,NA
medpulse international journal of microbiology,Text in English,2550-7648,NA
medpulse international journal of ophthalmology,Text in English,2550-7575,NA
medpulse international journal of pathology,Text in English,2550-7605,NA
medpulse international journal of pharmacology,Text in English,2550-7567,NA
medpulse international journal of physiology,Text in English,2550-7613,NA
nigerian journal of space research,Text in English,2550-7893,NA
plasu journal of communication studies,Text in English,2550-7389,NA
pyrex journal of business and finance management research,Text in English,2550-7877,NA
pyrex journal of educational research and review,Text in English,2550-7885,NA
sau journal of management and social sciences,Text in English,2550-7303,NA
world journal of finance and investment research,Text in English,2550-7125,NA
nuhu bamalli polytechnic zaria multidisciplinary journal,Text in English,2545-5370,NA
preorc journal of arts and humanities,Text in English,2545-532X,NA
research journal of mass communication and information technology,Text in English,2695-2475,2545-529X
international journal of advances in medical sciences and biotechnology,Text in English,null,NA
international journal of management sciences,Text in English,null,NA
international journal of wildlife and endangered species conservation,Text in English,null,NA
information impact,Text in English,2141-4297,2360-994X
frontiers of agriculture and food technology,Text in English,7295-2849,NA
nigerian journal of technology,Text in English,0331-8443,2467-8821
basic research journal of agricultural science and review,Text in English,2315-6880,NA
basic research journal of business management and accounts,Text in English,2315-6899,NA
basic research journal of education research and review,Text in English,2315-6872,NA
journal of research in education and society,Text in English,2141-6753,NA
african journal of food science and technology,Text in English,2141-5455,NA
journal of research in international business and management,Text in English,2251-0028,NA
international research journal of engineering science technology and innovation,Text in English,2315-5663,NA
international research journal of microbiology,Text in English,2141-5463,NA
international research journal of plant science,Text in English,2141-5447,NA
journal of research in environmental science and toxicology,Text in English,2315-5698,NA
journal of research in nursing and midwifery,Text in English,2315-568X,NA
advances in agriculture and agricultural sciences,Text in English,2756-326X,NA
advances in aquaculture and fisheries management,Text in English,2756-3278,NA
advances in food science and technology,Text in English,2756-3286,NA
global journal of food and agribusiness management,Text in English,2756-343X,NA
global journal of food and agricultural sciences,Text in English,2756-3448,NA
global journal of plant and soil sciences,Text in English,2756-3626,NA
international journal of agricultural extension and rural development,Text in English,2756-3642,NA
international journal of animal breeding and genetics,Text in English,2756-3650,NA
international journal of enology and viticulture,Text in English,2756-3685,NA
international journal of food safety and public health,Text in English,2756-3693,NA
international journal of horticulture and floriculture,Text in English,2756-3790,NA
international journal of irrigation and water management,Text in English,2756-3804,NA
international journal of manures and fertilizers,Text in English,2756-3863,NA
international journal of plant breeding and genetics,Text in English,2756-3847,NA
advanced journal of environmental science and technology,Text in English,2756-3251,NA
advanced journal of microbiology research,Text in English,2736-1756,NA
african journal of botany,Text in English,2756-3294,NA
african journal of ecology and ecosystems,Text in English,2756-3367,NA
african journal of immunology research,Text in English,2756-3375,NA
african journal of parasitology research,Text in English,2756-3391,NA
african journal of virology research,Text in English,2756-3413,NA
international journal of bacteriology and mycology,Text in English,2756-3669,NA
international journal of histology and cytology,Text in English,2756-3707,NA
international journal of nematology and entomology,Text in English,2756-3839,NA
international journal of plant and animal sciences,Text in English,2756-388X,NA
african journal of aids and hiv research,Text in English,2736-1748,NA
african journal of dentistry,Text in English,2756-3421,NA
african journal of infectious diseases research,Text in English,2756-3340,NA
african journal of malaria and tropical diseases,Text in English,2736-173X,NA
african journal of medical case reports,Text in English,2756-3316,NA
african journal of medicine and surgery,Text in English,2756-3324,NA
african journal of nursing and midwifery,Text in English,2756-3332,NA
international journal of medical advances and discoveries,Text in English,2756-3812,NA
international journal of medical sociology and anthropology,Text in English,2756-3820,NA
international journal of obstetrics and gynecology,Text in English,2736-1594,NA
international journal of urology and nephrology,Text in English,2756-3855,NA
international journal of veterinary medicine and animal health,Text in English,2756-3871,NA
international journal of law and legal studies,Text in English,2736-1608,NA
african journal of estate and property management,Text in English,2756-3308,NA
african journal of gender and women studies,Text in English,2736-1578,NA
african journal of geography and regional planning,Text in English,2736-1586,NA
african journal of library and information science,Text in English,2756-3383,NA
african journal of philosophy and religious studies,Text in English,2756-3405,NA
global journal of business management,Text in English,2736-1721,NA
global journal of sociology and anthropology,Text in English,2756-3456,NA
international journal of accounting auditing and taxation,Text in English,2756-3634,NA
international journal of banking economics and finance,Text in English,2756-3677,NA
global advanced research journal of agricultural science,Text in English,2315-5094,NA
global advanced research journal of environmental science and toxicology,Text in English,2315-5140,NA
global advanced research journal of medicine and medical sciences,Text in English,2315-5159,NA
global advanced research journal of microbiology,Text in English,2315-5116,NA
greener journal of agricultural science,Text in English,2276-7770,NA
greener journal of agronomy forestry and horticulture,Text in English,2354-2306,NA
greener journal of biological science,Text in English,2276-7762,NA
greener journal of biomedical and health sciences,Text in English,2672-4529,NA
greener journal of business and management studies,Text in English,2276-7827,NA
greener journal of economics and accountancy,Text in English,2354-2357,NA
greener journal of education research,Text in English,2276-7789,NA
greener journal of epidemiology and public health,Text in English,2354-2381,NA
greener journal of library information and archival sciences,Text in English,2672-4472,NA
greener journal of medicinal plant research,Text in English,2672-4480,NA
greener journal of medical science,Text in English,2276-7797,NA
greener journal of physical science,Text in English,2276-7851,NA
greener journal of plant breeding and crop science,Text in English,2354-2292,NA
greener journal of psychology and counselling,Text in English,2672-4502,NA
greener journal of social sciences,Text in English,2276-7800,NA
greener journal of science engineering and technological research,Text in English,2276-7835,NA
international and multidisciplinary journal of global justice,Text in English,2672-4464,NA
e3 journal of medical research,Text in English,2276-9900,NA
e3 journal of business management and economics,Text in English,2141-7482,NA
direct research journal of biology and biotechnology,Text in English,2734-2158,NA
direct research journal of education and vocational studies,Text in English,2734-2174,NA
direct research journal of public health and environmental technology,Text in English,2734-2182,NA
direct research journal of veterinary medicine and animal science,Text in English,2734-2166,NA
journal of agriculture and environmental management,Text in English,2315-8719,NA
journal of business administration and management services research,Text in English,2315-8727,NA
journal of education research and behavioural science,Text in English,2315-8735,NA
journal of microbiology and immunology research,Text in English,2315-8743,NA
british journal of education learning and development psychology,Text in English,2682-6704,NA
african journal of accounting and financial research,Text in English,2682-6690,NA
british journal of management and marketing studies,Text in English,2689-5072,NA
african journal of economics and sustainable development,Text in English,2689-5080,NA
international journal of entrepreneurship and business innovation,Text in English,2689-9493,NA
african journal of social sciences and humanities research,Text in English,2689-5129,NA
