title,language,issn,issn2
miyetti quarterly law review,Text in English,2536-7803,2536-7811
nigerian journal of sociology and anthropology,Text in English,0331-4111,2536-7005
the savannah review,Text in English,2315-5523,2536-7846
sokoto journal of medical laboratory science,Text in English,2536-7153,NA
sospoly journal of arts and social science,Text in English,2536-717X,NA
sospoly journal of engineering entrepreneurship and environmental studies,Text in English,2536-7188,NA
sospoly journal of science and agriculture,Text in English,2536-7161,NA
sustainable human development review,Text in English,2006-8425,2536-6912
technoscience review,Text in English,2250-9046,2536-6920
archives of basic and applied medicine,Text in English,2384-6232,NA
fountain university journal of management and social sciences,Text in English,2408-6959,NA
fudma journal of arts management and social sciences,Text in English,2408-6967,NA
ijsar journal of advancement in education and computing,Text in English,2408-7661,NA
ijsar journal of advanced management and social sciences,Text in English,2408-767X,NA
ijsar journal of engineering and computing,Text in English,2408-7653,NA
ijsar journal of environmental earth and physical sciences,Text in English,2408-7645,NA
ijsar journal of law and allied disciplines,Text in English,2408-7629,NA
ijsar journal of life and applied sciences,Text in English,2408-7610,NA
ijsar journal of mathematics and applied statistics,Text in English,2408-7637,NA
international invention journal of agricultural and soil science,Text in English,2408-7254,NA
international invention journal of arts and social sciences,Text in English,2408-7238,NA
international invention journal of biochemistry and bioinformatics,Text in English,2408-722X,NA
international invention journal of medicine and medical sciences,Text in English,2408-7246,NA
international journal of environmental science and technology research,Text in English,2408-7262,NA
acoustical society of nigeria journal,Text in English,2408-6789,NA
merit journal of business and management,Text in English,2408-7041,NA
merit research journal of microbiology and biological sciences,Text in English,2408-7076,NA
pearl journal of management social science and humanities,Text in English,2449-1829,NA
research journal of educational studies and review,Text in English,2449-1837,NA
weber educational research and instructional studies,Text in English,2449-1608,NA
weber medicine and clinical case reports,Text in English,2449-1624,NA
education and science journal of policy review and curriculum development,Text in English,2315-8425,2354-1660
educational research,Text in English,2141-5161,NA
international journal of innovative research in education technology and social strategies,Text in English,2467-8163,NA
international journal of innovative research in technology basic and applied sciences,Text in English,2467-8171,NA
international journal of strategic research in education technology and humanities,Text in English,2467-818X,NA
global journal of medical research,Text in English,2467-8783,NA
international journal of agricultural and veterinary sciences,Text in English,2467-8708,NA
international journal of innovative medicine and medicinal plants research,Text in English,2467-8538,NA
international journal of innovative biochemistry and microbiology research,Text in English,2467-8554,NA
the international journal of innovative bioscience research,Text in English,2467-8457,NA
the international journal of innovative development and policy studies,Text in English,2467-8465,NA
the international journal of innovative finance and economics research,Text in English,2467-8473,NA
the international journal of innovative food nutrition and sustainable agriculture,Text in English,2467-8481,NA
international journal of innovative human ecology and nature studies,Text in English,2467-849X,NA
international journal of innovative information systems and technology research,Text in English,2467-8562,NA
international journal of innovative literature language and arts studies,Text in English,2467-8511,NA
international journal of innovative mathematics statistics and energy policy,Text in English,2467-852X,NA
international journal of innovative research in social sciences and strategic management techniques,Text in English,2467-8155,NA
journal for sustainable development law and policy,Text in English,2467-8406,2467-8392
journal of physical science and environmental studies,Text in English,2467-8716,NA
point journal of medicine and medical science research,Text in English,2467-8813,NA
research journal of engineering and technology,Text in English,2467-8775,NA
the research journal of health sciences,Text in English,2467-8252,NA
advances in scientific research and impact,Text in English,2476-8367,NA
agricultural and bionutritional research,Text in English,2476-7913,NA
biosciences research in todays world,Text in English,2476-7905,NA
contemporary journal of arts and sciences,Text in English,2476-7778,NA
funai journal of humanities and social sciences,Text in English,2476-7883,2476-7891
futo journal series,Text in English,2476-8456,NA
ideal international journal of igbo scholars forum nigeria,Text in English,2476-8421,NA
igbo scholars international journal of igbo scholars forum nigeria,Text in English,2476-843X,NA
international journal of innovative psychology and social development,Text in English,2467-8546,NA
international journal of media security and development,Text in English,2476-7808,2476-7794
journal of agricultural economics environment and social sciences,Text in English,2476-8723,NA
journal of environmental toxicology and public health,Text in English,2476-7948,NA
journal of evolution and taxonomy,Text in English,2476-7921,NA
journal of medical and biological sciences,Text in English,2476-857X,NA
achievers journal of scientific research,Text in English,2505-0141,NA
african journal of science and nature,Text in English,2536-6904,NA
agogo,Text in English,2536-6890,NA
azilo journal of humanities and social sciences,Text in English,2504-9631,NA
dynamic journal of pure and applied microbiology,Text in English,2536-6858,NA
funai journal of science and technology,Text in English,2504-9534,NA
international journal of advanced research in social sciences environmental studies and technology,Text in English,2536-6505,2536-6513
international journal of operational research in management social sciences and education,Text in English,2536-6521,2536-653X
journal of agricultural science and practice,Text in English,2536-7072,NA
journal of animal science and veterinary medicine,Text in English,2536-7099,NA
journal of applied sciences and development,Text in English,2536-6939,NA
journal of bioscience and biotechnology discovery,Text in English,2536-7064,NA
journal of economics and policy analysis,Text in English,2536-6874,NA
journal of public health pharmacology and toxicology,Text in English,2536-684X,NA
journal of renewable and alternative energy technologies,Text in English,2536-6629,2536-6610
nigerian journal of business and entrepreneurship education,Text in English,2536-6378,NA
ekpoma journal of theatre and media arts,Text in English,2006-1838,2449-1179
sokoto journal of veterinary sciences,Text in English,1595-093X,2315-6201
science journal of sociology and anthropology,Text in English,2276-6359,NA
research journal in organisational psychology and educational studies,Text in English,null,2276-8475
covenant journal of research in the built environment,Text in English,2384-5724,2384-5716
advancement in medicinal plant research,Text in English,2354-2152,NA
african educational research journal,Text in English,2354-2160,NA
african journal of advanced biotechnology,Text in English,2354-3825,NA
african journal of engineering research,Text in English,2354-2144,NA
biochemistry and biotechnology research,Text in English,2354-2136,NA
covenant journal of communication,Text in English,2354-354X,2354-3515
covenant journal of informatics and communication technology,Text in English,2354-3566,2354-3507
covenant journal of language studies,Text in English,2354-3582,2354-3523
academic research journal of agricultural science and research,Text in English,2360-7874,NA
african journal of microfinance and enterprise development,Text in English,2360-7726,NA
the caliphate journal of islamic research,Text in English,2360-9648,NA
ife journal of the humanities and social sciences,Text in English,2360-7769,NA
international journal of academic library and information science,Text in English,2360-7858,NA
international journal of academic research in education and review,Text in English,2360-7866,NA
international journal of educational policy research and review,Text in English,2360-7076,NA
international journal of english literature and culture,Text in English,2360-7831,NA
international journal of gender and development issues,Text in English,2360-8528,2545-501X
international journal of political science and development,Text in English,2360-784X,NA
journal of african culture and international understanding,Text in English,2360-7319,NA
society for peace studies and practice journal,Text in English,2360-9427,NA
kaduna journal of sociology,Text in English,2360-7734,NA
nsukka journal of the humanities,Text in English,null,2361-0034
scsr journal of agricultural sciences,Text in English,2360-9885,NA
scsr journal of business and entrepreneurship,Text in English,2360-9893,NA
scsr journal of social sciences and humanities,Text in English,2360-9877,NA
time journal of engineering and physical sciences,Text in English,2360-7335,NA
alhikmah journal of history and international relations,Text in English,2465-7336,NA
basic research journal of social and political sciences,Text in English,2465-7220,NA
bayero journal of social sciences and administration,Text in English,2465-7506,NA
coou interdisciplinary research journal,Text in English,2465-6739,NA
ilorin journal of marketing,Text in English,2465-7417,NA
international invention journal of engineering science and technology,Text in English,2465-7077,NA
international journal of innovative research in social and strategy management techniques,NA,2465-728X,NA
journal of agricultural science and food technology,Text in English,2465-7522,NA
journal of education and human development,Text in English,2465-7468,NA
kanta journal of general studies,Text in English,2465-664X,NA
osass journal,Text in English,2465-7395,NA
the journal of occupational safety and environmental health,Text in English,2476-8685,2476-8693
journal of physical science and environmental safety,Text in English,2476-8588,NA
life sciences research protocols and methods,Text in English,2476-793X,NA
molecular biology research and innovations,Text in English,2476-7956,NA
palgo journal of agriculture,Text in English,2476-8359,NA
palgo journal of education research,Text in English,2476-8332,NA
point journal of humanities and social sciences,Text in English,2476-8022,NA
point journal of botany and microbiological research,Text in English,2476-7999,NA
point journal of business and economic management,Text in English,2476-8014,NA
point journal of educational research and behavioral sciences,Text in English,2476-8006,NA
trends in industrial biotechnology research,Text in English,2476-7964,NA
world journal of biomedicine and pharmaceutical sciences,Text in English,2476-7972,NA
world journal of marine biology research,Text in English,2476-7980,NA
covenant journal of physical and life sciences,Text in English,2354-3574,2354-3485
covenant journal of politics and international affairs,Text in English,2354-3558,2354-3493
greener journal of education and training studies,Text in English,2354-225X,NA
greener journal of environment management and public safety,Text in English,2354-2276,NA
greener journal of microbiology and antimicrobials,Text in English,2354-2284,NA
international journal of advanced research in social engineering and development strategies,Text in English,2354-161X,NA
international journal of innovative agriculture and biology research,Text in English,2354-2934,NA
international journal of innovative education research,Text in English,2354-2942,NA
international journal of innovative environmental studies and research,Text in English,2354-2918,NA
international research journal of medicine and medical science,Text in English,2354-211X,NA
journal of good governance and susstainable development in africa,Text in English,2346-724X,2354-158X
microbiology research international,Text in English,2354-2128,NA
advanced journal of agricultural research,Text in English,2360-9354,NA
advanced research journal of plants and animal sciences,Text in English,2360-7947,NA
basic research journal of microbiology,Text in English,2354-4082,NA
basic research journal of soil and environmental science,Text in English,2354-4090,NA
direct research journal of chemistry and mineral science,Text in English,2354-4163,NA
direct research journal of engineering and information technology,Text in English,2354-4155,NA
direct research journal of agriculture and food science,Text in English,2354-4147,NA
global educational research journal,Text in English,2360-7963,NA
global journal of environmental sciences and technology,Text in English,2360-7955,NA
global research journal of public health and epidemiology,Text in English,2360-7920,NA
international journal of advanced studies in business strategies and management,Text in English,2354-4236,2354-4244
international journal of advanced studies in ecology development and sustainability,Text in English,2354-4252,2354-4260
international journal of advanced studies in economics and public sector management,Text in English,2354-421X,2354-4228
international journal of advanced studies in engineering and scientific inventions,Text in English,2354-4171,2354-418X
international journal of advances in scientific research and reviews,Text in English,2360-9338,NA
international journal of agricultural research and reviews,Text in English,2360-7971,NA
international journal of agricultural research sustainability and food sufficiency,Text in English,2360-932X,NA
international journal of arts and humanities,Text in English,2360-7998,NA
international journal of business and law research,Text in English,2360-8986,NA
international journal of comparative studies in international relations and development,Text in English,2354-4198,2354-4201
international journal of health safety and environment,Text in English,2360-9311,NA
international journal of innovative scientific and engineering technology research,Text in English,2360-896X,NA
international journal of innovative social and sciences education research,Text in English,2360-8978,NA
international research journal of public and environmental health,Text in English,2360-8803,NA
journal of agricultural economics extension and rural development,Text in English,2360-798X,NA
learned journal of science agriculture and engineering,Text in English,2360-8250,NA
sky journal of educational research,NA,2354-4406,NA
unilag journal of basic medical sciences,Text in English,2354-4368,NA
sokoto journal of social sciences,Text in English,1595-2738,2384-7654
wyno academic journal of social science,Text in English,2384-7808,NA
ijagun journal of history and diplomacy,Text in English,2408-5707,NA
ilorin journal of accounting,Text in English,2408-5375,NA
ilorin journal of science,Text in English,2408-4816,NA
kaduna journal of political science,Text in English,2408-5146,NA
nials journal of business law,Text in English,2408-4921,NA
nigerian journal of applied behavioural sciences,Text in English,2408-5413,NA
pencil publication of agricultural sciences,Text in English,2408-5545,NA
pencil publication of arts and education,Text in English,2408-5537,NA
pencil publication of biological science,Text in English,2408-5529,NA
pencil publication of medical and pharmaceutical sciences,Text in English,2408-5553,NA
unilag journal of humanities,Text in English,2408-5006,NA
unilag journal of medicine science and technology,Text in English,2408-5022,NA
journal of home economics research,Text in English,1118-0021,NA
the nigerian journal of parasitology,Text in English,1117-4145,NA
african journal of agricultural economics and rural development,Text in English,2375-0693,NA
african journal of agricultural marketing,Text in English,2375-1061,NA
african journal of agriculture,Text in English,2375-1134,NA
african journal of agriculture and food security,Text in English,2375-1177,NA
african journal of agronomy,Text in English,2375-1185,NA
african journal of crop science,Text in English,2375-1231,NA
african journal of dairy farming and milk production,Text in English,2375-1258,NA
african journal of environmental and waste management,Text in English,2375-1266,NA
international journal of agroforestry and silviculture,Text in English,2375-1096,NA
african journal of environmental economics and management,Text in English,2375-0707,NA
african journal of fisheries science,Text in English,2375-0715,NA
african journal of food science research,Text in English,2375-0723,NA
african journal of pig farming,Text in English,2375-0731,NA
african journal of plant breeding,Text in English,2375-074X,NA
african journal of poultry farming,Text in English,2375-0863,NA
african journal of soil science,Text in English,2375-088X,NA
african journal of tropical agriculture,Text in English,2375-091X,NA
african journal of water conservation and sustainability,Text in English,2375-0936,NA
arid zone journal of engineering technology and environment,Text in English,1596-2644,2545-5818
rwanda journal of medicine and health sciences,Text in English,2616-9819,2616-9827
rwanda medical journal,Text in French | Text in English,2079-097X,2410-8626
diapason,Text in Kinyarwanda,null,NA
universite nationale du rwanda revue scientifique du droit,Text in French | Text in Kinyarwanda | Text in English,null,NA
journal of african conflicts and peace studies,Text in English,1996-3157,2325-484X
rwandan journal of education,NA,2227-9148,2312-9239
rwanda journal of social and applied sciences,Text in French | Text in English,2310-3205,2313-6723
african journal of business and industry,Text in English,2413-3213,NA
international journal of the university of kibungo association,Text in English,2522-3275,NA
kibogora polytechnic scientific journal,Text in English,2616-7492,2616-7506
rwanda journal of engineering science technology and environment,Text in English,2617-2321,2617-233X
southern african journal of infectious diseases,Text in English,2312-0053,2313-1810
africa 2001,Text in Afrikaans | Text in English,1019-2182,NA
old testament essays,NA,1010-9919,2312-3621
tydskrif vir die suid afrikaanse reg,Text in Dutch | Text in Afrikaans | Summaries in English | Text in English,0257-7747,1996-2207
scriptura,NA,0254-1807,2305-445X
strategic review for southern africa,Text in Dutch | Text in English,1013-1108,NA
suid afrikaanse tydskrif vir natuurwetenskap en tegnologie,Text in Afrikaans | Summaries in English | Summaries in Afrikaans,0254-3486,2222-4173
southern african linguistics and applied language studies,NA,1607-3614,1727-9461
aeronautica meridiana,Summaries in English | Text in English | Summaries in Afrikaans,0257-8573,NA
journal for juridical science,Text in Afrikaans | Text in English,0258-252X,2415-0517
relational child youth care practice online,Text in English,2410-2954,NA
industrial law journal,Text in English,0258-249X,2413-9882
grace and truth,Text in English,2304-0084,NA
south african journal of agricultural extension,NA,0301-603X,2413-3221
literator,Text in French | Text in German | Text in Dutch | Text in Afrikaans | Summaries in English | Text in English,0258-2279,2219-8237
tydskrif vir taalonderrig,Text in Afrikaans | Text in English,0259-9570,NA
kronos,Text in Afrikaans | Text in English,0259-0190,2309-9585
communicare,NA,0259-0069,NA
south african journal of labour relations,Text in Afrikaans | Text in English,0379-8410,2520-3223
orion,NA,0259-191X,2224-0004
clean air journal,Text in Afrikaans | Text in English,1017-1703,2410-972X
suidafrikaanse tydskrif vir navorsing in sport liggaamlike opvoedkunde en ontspanning,Text in Afrikaans | Summaries in English | Text in English,0379-9069,NA
adler museum bulletin,Text in English,0379-6531,NA
hervormde teologiese studies,Text in German | Text in Dutch | Text in Afrikaans | Summaries in English | Text in English,0259-9422,2072-8050
verbum et ecclesia,Text in Afrikaans,1609-9982,2074-7705
south african music studies,Text in English,2223-635X,NA
southern african humanities,Text in French | Text in German | Summaries in English | Text in English,1681-5564,2305-2791
politeia,Text in English,0256-8845,NA
de jure,Text in Afrikaans | Text in English,1466-3597,2225-7160
journal of literary studies,Text in Afrikaans | Text in English,0256-4718,NA
journal of energy in southern africa print,Text in English,1021-447X,NA
the journal of medical laboratory science technology of south africa,Text in English,2664-2549,2664-2832
nomina africana,Summaries in French | Text in Afrikaans | Summaries in Dutch | Summaries in German | Summaries in English | Text in English | Summaries in Afrikaans,1012-0254,NA
southern african public law,Text in English,2219-6412,2522-6800
shakespeare in southern africa,Text in English,1011-582X,2071-7504
nidan,Text in English,1016-5320,2414-8636
south african journal of criminal justice,Text in English,1011-8527,1996-2118
pretoriana,Text in English,null,NA
psychology bulletin,Text in English,null,NA
studies in toegepaste linguistiek en literatuurwetenskap,Text in English,null,NA
communitas,Text in Afrikaans | Text in English,1023-0556,2415-0525
edge port elizabeth,Text in English,null,NA
cardiovascular journal of africa,Text in English,1995-1892,1996-3467
quaestiones mathematicae,Text in English,1607-3606,1727-933X
south african journal of higher education,Text in English,1011-3487,1753-5913
south african institute of race relations fast facts,Text in English,1019-2514,NA
curationis,Text in Afrikaans | Text in English,0379-8577,2223-6279
studi ditalianistica nellafrica australe,Text in Italian | Text in English,1012-2338,2225-7039
the southern african journal of critical care,Text in English,1562-8264,2078-676X
south african journal of psychiatry,Text in English,1608-9685,2078-6786
the south african journal of clinical nutrition,Text in English,1607-0658,2221-1268
south african journal of obstetrics and gynaecology,Text in English,0038-2329,2305-8862
unisa latin american report,Summaries in Spanish | Summaries in Portuguese | Text in English,0256-6060,NA
metamorphosis,Text in English,1018-6409,2307-5031
ur uct,Text in English,2413-0672,NA
folio,Text in English,2520-3681,NA
natalia,Text in English,null,0085-3674
studia historiae ecclesiasticae online,Text in English,2412-4265,NA
sotl in the south,Text in English,2523-1154,NA
south african journal of oncology,Text in English,2518-8704,2523-0646
african human rights yearbook,Text in French | Text in English,2523-1367,NA
aros joernaal,Text in Dutch | Text in Afrikaans,2523-1375,NA
speculum juris,Text in English,2523-2177,0584-8652
journal of neutral atmosphere,Text in English,2523-1812,NA
journal of construction project management and innovation,Text in English,2223-7852,NA
durban natural science museum novitates,Text in English,null,2522-2554
african music,Text in French | Text in English,2524-2741,0065-4019
journal of medicinal plants for economic development,Text in English,2616-4809,2519-559X
afro asian journal of science and technology,Text in English,2312-7465,NA
image text online,Text in English,2617-3255,NA
african journal of career development,Text in English,2709-7420,2617-7471
journal of local government research and innovation,Text in English,2709-7412,2788-919X
teacher education through flexible learning in africa,Text in English,2788-6298,NA
international journal of architecture and planning,Text in English,2788-5046,NA
international journal of african studies,Text in English,2710-4680,NA
international journal of languages and culture,Text in English,2788-404X,NA
international journal of cryptocurrency research,Text in English,2790-1386,NA
african journal of pharmaceutical sciences,Text in English,2789-5092,NA
international journal of political science and public administration,Text in English,2788-8983,NA
international journal of tourism and hospitality,Text in English,2709-9768,NA
international journal of pure and applied mathematics research,Text in English,2789-9160,NA
international journal of data science and big data analytics,Text in English,2710-2599,NA
african journal of humanities and social sciences,Text in English,2789-3413,NA
international journal of management research and economics,Text in English,2710-141X,NA
international journal of agricultural sciences and technology,Text in English,2710-3366,NA
international journal of education and teaching,Text in English,2788-5011,NA
international journal of artificial intelligence and machine learning,Text in English,2789-2557,NA
africanus,Text in English,0304-615X,NA
african vision and eye health,Text in English,2413-3183,2410-1516
the journal of consumer sciences,Text in English,null,NA
journal for the study of religion,Text in English,1011-7601,2413-3027
ecquid novi african journalism studies,Text in German | Text in Dutch | Text occasionally in Afrikaans | Text in Afrikaans,1942-0773,NA
critical arts,Text in English,1992-6049,NA
south african journal of education,NA,0256-0100,2076-3433
journal of northwest semitic languages,Text in German | Summaries in English | Text in English,0259-0131,NA
musicus,Text in Afrikaans | Text in English,0256-8837,NA
